<?xml version="1.0" encoding="UTF-8"?>
<!--
  Copyright 2014 Virginia Polytechnic Institute and State University
  
  Licensed under the Apache License, Version 2.0 (the "License");
  you may not use this file except in compliance with the License.
  You may obtain a copy of the License at
  
    http://www.apache.org/licenses/LICENSE-2.0
  
  Unless required by applicable law or agreed to in writing, software
  distributed under the License is distributed on an "AS IS" BASIS,
  WITHOUT WARRANTIES OR CONDITIONS OF ANY KIND, either express or implied.
  See the License for the specific language governing permissions and
  limitations under the License.
-->
<!DOCTYPE deployments PUBLIC "-//JBoss Portal//DTD Portal Object 2.6//EN" "http://www.jboss.org/portal/dtd/portal-object_2_6.dtd">
<deployments>
	<deployment>
		<parent-ref>patric</parent-ref>
		<if-exists>overwrite</if-exists>
		<page>
			<page-name>FIGfam</page-name>
			<properties>
				<property>
					<name>layout.id</name>
					<value>patric-full</value>
				</property>
			</properties>
			<window>
				<window-name>BreadCrumbWindow</window-name>
				<content>
					<content-type>portlet</content-type>
					<content-uri>BreadCrumbInstance</content-uri>
				</content>
				<region>top</region>
				<height>0</height>
				<properties>
					<property>
						<name>theme.renderSetId</name>
						<value>emptyRenderer</value>
					</property>
				</properties>
			</window>
			<window>
				<window-name>FIGfamWindow</window-name>
				<instance-ref>FIGfamInstance</instance-ref>
				<region>center</region>
				<height>0</height>
				<properties>
					<property>
						<name>theme.renderSetId</name>
						<value>emptyRenderer</value>
					</property>
				</properties>
			</window>
			<coordination>
				<bindings>
					<implicit-mode>FALSE</implicit-mode>
					<alias-binding>
						<id>cType</id>
						<qname>{http://patricbrc.org/params}context_type</qname>
					</alias-binding>
					<alias-binding>
						<id>cId</id>
						<qname>{http://patricbrc.org/params}context_id</qname>
					</alias-binding>
					<alias-binding>
						<id>figfam_names</id>
						<qname>{http://patricbrc.org/params}figfam_names</qname>
					</alias-binding>
					<alias-binding>
						<id>FAM_TYPE</id>
						<qname>{http://patricbrc.org/params}FAM_TYPE</qname>
					</alias-binding>
					<alias-binding>
						<id>genome_ids</id>
						<qname>{http://patricbrc.org/params}genome_ids</qname>
					</alias-binding>
					<alias-binding>
						<id>dm</id>
						<qname>{http://patricbrc.org/params}display_mode</qname>
					</alias-binding>
					<alias-binding>
						<id>pk</id>
						<qname>{http://patricbrc.org/params}param_key</qname>
					</alias-binding>
					<alias-binding>
						<id>bm</id>
						<qname>{http://patricbrc.org/params}breadcrumb_mode</qname>
					</alias-binding>
				</bindings>
			</coordination>
		</page>
	</deployment>
	<deployment>
		<parent-ref>patric</parent-ref>
		<if-exists>overwrite</if-exists>
		<page>
			<page-name>SingleFIGfam</page-name>
			<properties>
				<property>
					<name>layout.id</name>
					<value>patric-full</value>
				</property>
			</properties>
			<window>
				<window-name>BreadCrumbWindow</window-name>
				<content>
					<content-type>portlet</content-type>
					<content-uri>BreadCrumbInstance</content-uri>
				</content>
				<region>top</region>
				<height>0</height>
				<properties>
					<property>
						<name>theme.renderSetId</name>
						<value>emptyRenderer</value>
					</property>
				</properties>
			</window>
			<window>
				<window-name>SingleFIGfamWindow</window-name>
				<instance-ref>SingleFIGfamInstance</instance-ref>
				<region>center</region>
				<height>0</height>
			</window>
			<coordination>
				<bindings>
					<implicit-mode>FALSE</implicit-mode>
					<alias-binding>
						<id>cType</id>
						<qname>{http://patricbrc.org/params}context_type</qname>
					</alias-binding>
					<alias-binding>
						<id>cId</id>
						<qname>{http://patricbrc.org/params}context_id</qname>
					</alias-binding>
					<alias-binding>
						<id>pk</id>
						<qname>{http://patricbrc.org/params}param_key</qname>
					</alias-binding>
					<alias-binding>
						<id>bm</id>
						<qname>{http://patricbrc.org/params}breadcrumb_mode</qname>
					</alias-binding>
				</bindings>
			</coordination>
		</page>
	</deployment>
	<deployment>
		<parent-ref>patric</parent-ref>
		<if-exists>overwrite</if-exists>
		<page>
			<page-name>MSA</page-name>
			<properties>
				<property>
					<name>layout.id</name>
					<value>patric-full</value>
				</property>
			</properties>
			<window>
				<window-name>MSAWindow</window-name>
				<instance-ref>MSAInstance</instance-ref>
				<region>center</region>
				<height>0</height>
			</window>
			<coordination>
				<bindings>
					<implicit-mode>FALSE</implicit-mode>
					<alias-binding>
						<id>cType</id>
						<qname>{http://patricbrc.org/params}context_type</qname>
					</alias-binding>
					<alias-binding>
						<id>cId</id>
						<qname>{http://patricbrc.org/params}context_id</qname>
					</alias-binding>
					<alias-binding>
						<id>figfamNames</id>
						<qname>{http://patricbrc.org/params}figfam_names</qname>
					</alias-binding>
					<alias-binding>
						<id>famType</id>
						<qname>{http://patricbrc.org/params}FAM_TYPE</qname>
					</alias-binding>
					<alias-binding>
						<id>featureIDs</id>
						<qname>{http://patricbrc.org/params}feature_ids</qname>
					</alias-binding>
					<alias-binding>
						<id>pk</id>
						<qname>{http://patricbrc.org/params}param_key</qname>
					</alias-binding>
					<alias-binding>
						<id>bm</id>
						<qname>{http://patricbrc.org/params}breadcrumb_mode</qname>
					</alias-binding>
				</bindings>
			</coordination>
		</page>
	</deployment>
</deployments>
