<?xml version="1.0" encoding="UTF-8"?>
<!--
  Copyright 2013 Virginia Polytechnic Institute and State University
  
  Licensed under the Apache License, Version 2.0 (the "License");
  you may not use this file except in compliance with the License.
  You may obtain a copy of the License at
  
    http://www.apache.org/licenses/LICENSE-2.0
  
  Unless required by applicable law or agreed to in writing, software
  distributed under the License is distributed on an "AS IS" BASIS,
  WITHOUT WARRANTIES OR CONDITIONS OF ANY KIND, either express or implied.
  See the License for the specific language governing permissions and
  limitations under the License.
-->
<!DOCTYPE deployments PUBLIC "-//JBoss Portal//DTD Portal Object 2.6//EN" "http://www.jboss.org/portal/dtd/portal-object_2_6.dtd">
<deployments>
	<deployment>
		<parent-ref></parent-ref>
		<if-exists>keep</if-exists>
		<portal>
			<portal-name>patric</portal-name>
			<supported-modes>
				<mode>view</mode>
			</supported-modes>
			<supported-window-states>
				<window-state>normal</window-state>
			</supported-window-states>
			<properties>
				<property>
					<name>layout.id</name>
					<value>patric</value>
				</property>
				<property>
					<name>theme.id</name>
					<value>patric</value>
				</property>
			</properties>
		</portal>
	</deployment>
	<deployment>
		<parent-ref>patric</parent-ref>
		<if-exists>overwrite</if-exists>
		<page>
			<page-name>Home</page-name>
			<properties>
				<property>
					<name>layout.id</name>
					<value>patric-home</value>
				</property>
			</properties>
			<window>
				<window-name>HomeWindow</window-name>
				<instance-ref>HomeInstance</instance-ref>
				<region>left</region>
				<height>0</height>
				<properties>
					<property>
						<name>theme.renderSetId</name>
						<value>emptyRenderer</value>
					</property>
				</properties>
			</window>
		</page>
	</deployment>
	<deployment>
		<parent-ref>patric</parent-ref>
		<if-exists>overwrite</if-exists>
		<page>
			<page-name>Workflow</page-name>
			<properties>
				<property>
					<name>layout.id</name>
					<value>patric-home</value>
				</property>
			</properties>
			<window>
				<window-name>WorkflowWindow</window-name>
				<instance-ref>WorkflowInstance</instance-ref>
				<region>left</region>
				<height>0</height>
				<properties>
					<property>
						<name>theme.renderSetId</name>
						<value>emptyRenderer</value>
					</property>
				</properties>
			</window>
			<coordination>
				<bindings>
					<implicit-mode>FALSE</implicit-mode>
					<alias-binding>
						<id>page</id>
						<qname>{http://patric.vbi.vt.edu/params}page</qname>
					</alias-binding>
				</bindings>
			</coordination>
		</page>
	</deployment>
	<deployment>
		<parent-ref>patric</parent-ref>
		<if-exists>overwrite</if-exists>
		<page>
			<page-name>IncumbentBRCs</page-name>
			<properties>
				<property>
					<name>layout.id</name>
					<value>patric-home</value>
				</property>
			</properties>
			<window>
				<window-name>IBRCsWindow</window-name>
				<instance-ref>IBRCsInstance</instance-ref>
				<region>left</region>
				<height>0</height>
				<properties>
					<property>
						<name>theme.renderSetId</name>
						<value>emptyRenderer</value>
					</property>
				</properties>
			</window>
			<coordination>
				<bindings>
					<implicit-mode>FALSE</implicit-mode>
					<alias-binding>
						<id>page</id>
						<qname>{http://patric.vbi.vt.edu/params}page</qname>
					</alias-binding>
				</bindings>
			</coordination>
		</page>
	</deployment>
	<deployment>
		<parent-ref>patric</parent-ref>
		<if-exists>overwrite</if-exists>
		<page>
			<page-name>RAST</page-name>
			<properties>
				<property>
					<name>layout.id</name>
					<value>patric-full</value>
				</property>
			</properties>
			<window>
				<window-name>BreadCrumbWindow</window-name>
				<content>
					<content-type>portlet</content-type>
					<content-uri>BreadCrumbInstance</content-uri>
				</content>
				<region>top</region>
				<height>0</height>
				<properties>
					<property>
						<name>theme.renderSetId</name>
						<value>emptyRenderer</value>
					</property>
				</properties>
			</window>
			<window>
				<window-name>RASTWindow</window-name>
				<instance-ref>RASTInstance</instance-ref>
				<region>center</region>
				<height>0</height>
				<properties>
					<property>
						<name>theme.renderSetId</name>
						<value>emptyRenderer</value>
					</property>
				</properties>
			</window>
		</page>
	</deployment>
	<deployment>
		<parent-ref>patric</parent-ref>
		<if-exists>overwrite</if-exists>
		<page>
			<page-name>MGRAST</page-name>
			<properties>
				<property>
					<name>layout.id</name>
					<value>patric-full</value>
				</property>
			</properties>
			<window>
				<window-name>BreadCrumbWindow</window-name>
				<content>
					<content-type>portlet</content-type>
					<content-uri>BreadCrumbInstance</content-uri>
				</content>
				<region>top</region>
				<height>0</height>
				<properties>
					<property>
						<name>theme.renderSetId</name>
						<value>emptyRenderer</value>
					</property>
				</properties>
			</window>
			<window>
				<window-name>MGRASTWindow</window-name>
				<instance-ref>MGRASTInstance</instance-ref>
				<region>center</region>
				<height>0</height>
				<properties>
					<property>
						<name>theme.renderSetId</name>
						<value>emptyRenderer</value>
					</property>
				</properties>
			</window>
		</page>
	</deployment>
	<deployment>
		<parent-ref>patric</parent-ref>
		<if-exists>overwrite</if-exists>
		<page>
			<page-name>NaCTeM</page-name>
			<properties>
				<property>
					<name>layout.id</name>
					<value>patric-home</value>
				</property>
			</properties>
			<window>
				<window-name>NACTEMWindow</window-name>
				<instance-ref>NACTEMInstance</instance-ref>
				<region>left</region>
				<height>0</height>
				<properties>
					<property>
						<name>theme.renderSetId</name>
						<value>emptyRenderer</value>
					</property>
				</properties>
			</window>
		</page>
	</deployment>
	<deployment>
		<parent-ref>patric</parent-ref>
		<if-exists>overwrite</if-exists>
		<page>
			<page-name>TB</page-name>
			<properties>
				<property>
					<name>layout.id</name>
					<value>patric-home</value>
				</property>
			</properties>
			<window>
				<window-name>TBWindow</window-name>
				<instance-ref>TBInstance</instance-ref>
				<region>left</region>
				<height>0</height>
				<properties>
					<property>
						<name>theme.renderSetId</name>
						<value>emptyRenderer</value>
					</property>
				</properties>
			</window>
		</page>
	</deployment>
	<deployment>
		<parent-ref>patric</parent-ref>
		<if-exists>overwrite</if-exists>
		<page>
			<page-name>Upload2PATRIC</page-name>
			<properties>
				<property>
					<name>layout.id</name>
					<value>patric-compatible</value>
				</property>
			</properties>
			<window>
				<window-name>U2PWindow</window-name>
				<instance-ref>U2PInstance</instance-ref>
				<region>center</region>
				<height>0</height>
				<properties>
					<property>
						<name>theme.renderSetId</name>
						<value>emptyRenderer</value>
					</property>
				</properties>
			</window>
			<coordination>
				<bindings>
					<implicit-mode>FALSE</implicit-mode>
					<alias-binding>
						<id>data_url</id>
						<qname>{http://patric.vbi.vt.edu/params}data_url</qname>
					</alias-binding>
				</bindings>
			</coordination>
		</page>
	</deployment>
	<deployment>
		<parent-ref>patric</parent-ref>
		<if-exists>overwrite</if-exists>
		<page>
			<page-name>Genomes</page-name>
			<properties>
				<property>
					<name>layout.id</name>
					<value>patric-home</value>
				</property>
			</properties>
			<window>
				<window-name>GenomesWindow</window-name>
				<instance-ref>GenomesInstance</instance-ref>
				<region>left</region>
				<height>0</height>
				<properties>
					<property>
						<name>theme.renderSetId</name>
						<value>emptyRenderer</value>
					</property>
				</properties>
			</window>
		</page>
	</deployment>
	<deployment>
		<parent-ref>patric</parent-ref>
		<if-exists>overwrite</if-exists>
		<page>
			<page-name>ProteinFamilies</page-name>
			<properties>
				<property>
					<name>layout.id</name>
					<value>patric-home</value>
				</property>
			</properties>
			<window>
				<window-name>ProteinFamiliesWindow</window-name>
				<instance-ref>ProteinFamiliesInstance</instance-ref>
				<region>left</region>
				<height>0</height>
				<properties>
					<property>
						<name>theme.renderSetId</name>
						<value>emptyRenderer</value>
					</property>
				</properties>
			</window>
		</page>
	</deployment>
</deployments>
